<?xml version="1.0" encoding="ISO-8859-1"?>
<TABLE NAME="ALLEARTIKEL" xmlns:xsi="http://www.w3.org/2001/XMLSchema-instance" xsi:noNamespaceSchemaLocation="ARTIKEL1.XSD">
  
    <ARTIKEL>
        <ARTNR>101</ARTNR>
        <ARTBEZ>Deo12</ARTBEZ>
        <MGE>stk</MGE>
        <PREIS>1.29</PREIS>
        <KUEHL>NK</KUEHL>
        <EDAT>2017-12-02</EDAT>
    </ARTIKEL>

    <ARTIKEL>
        <ARTNR>3</ARTNR>
        <ARTBEZ>Toast12</ARTBEZ>
        <MGE>kg</MGE>
        <PREIS>3.99</PREIS>
        <KUEHL>NK</KUEHL>
        <EDAT>2001-01-01</EDAT>
    </ARTIKEL>
</TABLE>